{
  "id": "humanoid.biped.v1",
  "type": "humanoid",
  "version": 1,
  "description": "Two-legged, two-armed character seen from the front. The default template.",
  "landmarks": {
    "head_top": { "x": 0.5, "y": 0.0 },
    "head_center": { "x": 0.5, "y": 0.07 },
    "chin": { "x": 0.5, "y": 0.14 },
    "neck": { "x": 0.5, "y": 0.16 },
    "chest": { "x": 0.5, "y": 0.26 },
    "shoulder_c": { "x": 0.5, "y": 0.19 },
    "shoulder_l": { "x": 0.37, "y": 0.2 },
    "shoulder_r": { "x": 0.63, "y": 0.2 },
    "elbow_l": { "x": 0.32, "y": 0.35 },
    "elbow_r": { "x": 0.68, "y": 0.35 },
    "wrist_l": { "x": 0.29, "y": 0.49 },
    "wrist_r": { "x": 0.71, "y": 0.49 },
    "hand_l": { "x": 0.28, "y": 0.535 },
    "hand_r": { "x": 0.72, "y": 0.535 },
    "hip_c": { "x": 0.5, "y": 0.5 },
    "pelvis_center": { "x": 0.5, "y": 0.47 },
    "hip_l": { "x": 0.435, "y": 0.505 },
    "hip_r": { "x": 0.565, "y": 0.505 },
    "knee_l": { "x": 0.425, "y": 0.72 },
    "knee_r": { "x": 0.575, "y": 0.72 },
    "ankle_l": { "x": 0.415, "y": 0.925 },
    "ankle_r": { "x": 0.585, "y": 0.925 },
    "foot_l": { "x": 0.385, "y": 0.985 },
    "foot_r": { "x": 0.615, "y": 0.985 }
  },
  "parts": [
    { "id": "pelvis", "z": 41, "skin": "rigid", "bone": "pelvis", "anchors": ["hip_c", "hip_l", "hip_r"], "radius": 0.075 },
    { "id": "torso", "z": 40, "skin": "rigid", "bone": "spine", "anchors": ["chest", "shoulder_c", "hip_c"], "radius": 0.09 },
    { "id": "neck", "z": 45, "skin": "rigid", "bone": "neck", "anchors": ["neck"], "radius": 0.022 },
    { "id": "head", "z": 60, "skin": "rigid", "bone": "head", "anchors": ["head_center"], "radius": 0.062 },
    { "id": "upper_arm_l", "z": 50, "skin": "weighted", "bone": "upper_arm_l", "anchors": ["shoulder_l"], "radius": 0.026 },
    { "id": "lower_arm_l", "z": 51, "skin": "weighted", "bone": "lower_arm_l", "anchors": ["elbow_l"], "radius": 0.022 },
    { "id": "hand_l", "z": 52, "skin": "rigid", "bone": "hand_l", "anchors": ["wrist_l"], "radius": 0.018 },
    { "id": "upper_arm_r", "z": 50, "skin": "weighted", "bone": "upper_arm_r", "anchors": ["shoulder_r"], "radius": 0.026 },
    { "id": "lower_arm_r", "z": 51, "skin": "weighted", "bone": "lower_arm_r", "anchors": ["elbow_r"], "radius": 0.022 },
    { "id": "hand_r", "z": 52, "skin": "rigid", "bone": "hand_r", "anchors": ["wrist_r"], "radius": 0.018 },
    { "id": "upper_leg_l", "z": 32, "skin": "weighted", "bone": "thigh_l", "anchors": ["hip_l"], "radius": 0.036 },
    { "id": "lower_leg_l", "z": 33, "skin": "weighted", "bone": "shin_l", "anchors": ["knee_l"], "radius": 0.028 },
    { "id": "foot_l", "z": 34, "skin": "rigid", "bone": "foot_l", "anchors": ["ankle_l"], "radius": 0.02 },
    { "id": "upper_leg_r", "z": 32, "skin": "weighted", "bone": "thigh_r", "anchors": ["hip_r"], "radius": 0.036 },
    { "id": "lower_leg_r", "z": 33, "skin": "weighted", "bone": "shin_r", "anchors": ["knee_r"], "radius": 0.028 },
    { "id": "foot_r", "z": 34, "skin": "rigid", "bone": "foot_r", "anchors": ["ankle_r"], "radius": 0.02 }
  ],
  "bones": [
    { "id": "root", "parent": null, "head": "hip_c", "tail": "hip_c", "length": "landmark", "part": null },
    { "id": "pelvis", "parent": "root", "head": "hip_c", "tail": "pelvis_center", "length": "from_mask", "part": "pelvis", "direction": "head_to_tail" },
    { "id": "spine", "parent": "root", "head": "hip_c", "tail": "neck", "length": "landmark", "part": "torso" },
    { "id": "neck", "parent": "spine", "head": "neck", "tail": "head_center", "length": "landmark", "part": "neck" },
    { "id": "head", "parent": "neck", "head": "head_center", "tail": "head_top", "length": "from_mask", "part": "head", "direction": "head_to_tail" },
    { "id": "shoulder_l", "parent": "spine", "head": "shoulder_c", "tail": "shoulder_l", "length": "landmark", "part": null },
    { "id": "upper_arm_l", "parent": "shoulder_l", "head": "shoulder_l", "tail": "elbow_l", "length": "from_mask", "part": "upper_arm_l", "direction": "head_to_tail" },
    { "id": "lower_arm_l", "parent": "upper_arm_l", "head": "elbow_l", "tail": "wrist_l", "length": "from_mask", "part": "lower_arm_l", "direction": "head_to_tail" },
    { "id": "hand_l", "parent": "lower_arm_l", "head": "wrist_l", "tail": "hand_l", "length": "from_mask", "part": "hand_l", "direction": "head_to_tail" },
    { "id": "shoulder_r", "parent": "spine", "head": "shoulder_c", "tail": "shoulder_r", "length": "landmark", "part": null },
    { "id": "upper_arm_r", "parent": "shoulder_r", "head": "shoulder_r", "tail": "elbow_r", "length": "from_mask", "part": "upper_arm_r", "direction": "head_to_tail" },
    { "id": "lower_arm_r", "parent": "upper_arm_r", "head": "elbow_r", "tail": "wrist_r", "length": "from_mask", "part": "lower_arm_r", "direction": "head_to_tail" },
    { "id": "hand_r", "parent": "lower_arm_r", "head": "wrist_r", "tail": "hand_r", "length": "from_mask", "part": "hand_r", "direction": "head_to_tail" },
    { "id": "thigh_l", "parent": "root", "head": "hip_l", "tail": "knee_l", "length": "from_mask", "part": "upper_leg_l", "direction": "head_to_tail" },
    { "id": "shin_l", "parent": "thigh_l", "head": "knee_l", "tail": "ankle_l", "length": "from_mask", "part": "lower_leg_l", "direction": "head_to_tail" },
    { "id": "foot_l", "parent": "shin_l", "head": "ankle_l", "tail": "foot_l", "length": "from_mask", "part": "foot_l", "direction": "head_to_tail" },
    { "id": "thigh_r", "parent": "root", "head": "hip_r", "tail": "knee_r", "length": "from_mask", "part": "upper_leg_r", "direction": "head_to_tail" },
    { "id": "shin_r", "parent": "thigh_r", "head": "knee_r", "tail": "ankle_r", "length": "from_mask", "part": "lower_leg_r", "direction": "head_to_tail" },
    { "id": "foot_r", "parent": "shin_r", "head": "ankle_r", "tail": "foot_r", "length": "from_mask", "part": "foot_r", "direction": "head_to_tail" }
  ],
  "proportions": {
    "head": 0.035,
    "torso": 0.15,
    "pelvis": 0.05,
    "neck": 0.008,
    "upper_arm_l": 0.02,
    "lower_arm_l": 0.017,
    "hand_l": 0.008,
    "upper_arm_r": 0.02,
    "lower_arm_r": 0.017,
    "hand_r": 0.008,
    "upper_leg_l": 0.04,
    "lower_leg_l": 0.03,
    "foot_l": 0.012,
    "upper_leg_r": 0.04,
    "lower_leg_r": 0.03,
    "foot_r": 0.012
  }
}
